{
  "educationLevel": "enim",
  "id": null,
  "institutionName": "Duis nostrud",
  "educationName": "esse proident",
  "auditInfo": {
    "isDeleted": true,
    "createdBy": "Ut consectetur",
    "updatedBy": "occaecat sit sunt",
    "updatedDate": null,
    "createdDate": null
  },
  "individual": [
    "amet dolore Excepteur magna"
  ],
  "graduationDate": null
}
